{
  "submission_id": "sub_001",
  "brand_id": "brand_flowpilot",
  "author_id": "user_creator",
  "title": "Launch copy",
  "channel": "linkedin",
  "state": "REVIEW_REQUIRED",
  "current_revision_id": "rev_001",
  "revision_no": 1,
  "knowledge_version_id": "kv_001",
  "finding_counts": {
    "blocker": 1,
    "warning": 1,
    "info": 0
  },
  "updated_at": "2026-10-25T00:00:00Z"
}
